review_date,source_id,candidate_id,source_name,published_at,title,url,theme,editorial_action,reason
2026-05-08,,multiple,Infobae,2026-05-07,"Solo tres candidatos en el debate presidencial de Rtvc: crece la polemica por la ausencia de los principales aspirantes",https://www.infobae.com/colombia/2026/05/07/solo-tres-candidatos-en-debate-presidencial-de-rtvc-crece-la-polemica-por-la-ausencia-de-los-principales-aspirantes/,debates_electorales,incorporar_contexto,"Sirve para registrar el deterioro de representatividad del debate de Rtvc por ausencias y reacomodos, pero no debe fragmentarse en intake candidato-a-candidato."
2026-05-08,,ivan-cepeda,Infobae,2026-05-07,"Cepeda reconocio casos de corrupcion en el gobierno Petro y prometio erradicarlos si la izquierda sigue en el poder",https://www.infobae.com/colombia/2026/05/07/cepeda-reconocio-casos-de-corrupcion-en-el-gobierno-petro-y-prometio-erradicarlos-si-la-izquierda-sigue-en-el-poder/,anticorrupcion_y_continuidad,reservar,"La declaracion tiene valor politico, pero no aporta instrumento, cronograma, autoridad ejecutora ni documento nuevo suficiente para intake formal."
2026-05-08,,paloma-valencia,Infobae,2026-05-07,"Mis chats estan en poder de alguien: Paloma Valencia denuncia presunto hackeo y acude a Jaime Lombana",https://www.infobae.com/colombia/2026/05/07/mis-chats-estan-en-poder-de-alguien-paloma-valencia-denuncia-presunto-hackeo-y-acude-a-jaime-lombana/,garantias_electorales,reservar,"Puede ser relevante para garantias electorales, pero por ahora depende de una denuncia verbal de campana sin soporte institucional publico suficiente."
2026-05-08,,claudia-lopez,Infobae,2026-05-07,"Claudia Lopez protagonizo una discusion en redes con concejala por lio con el RegioTram del Norte: dormidos o solapados",https://www.infobae.com/colombia/2026/05/07/claudia-lopez-protagonizo-una-discusion-en-redes-con-concejala-por-lio-con-el-regiotram-del-norte-dormidos-o-solapados/,infraestructura_y_gestion,no_incorporar,"Reabre un cruce politico sobre autoria de infraestructura, pero no agrega propuesta nueva, costo, cronograma o documento de campana."
2026-05-08,,luis-gilberto-murillo,Infobae,2026-05-07,"Politicos de izquierda se pronunciaron sobre la llegada de Luis Gilberto Murillo a la campana de Ivan Cepeda: estamos uniendo distintos sectores",https://www.infobae.com/colombia/2026/05/07/politicos-de-izquierda-se-pronunciaron-por-la-llegada-de-luis-gilberto-murillo-a-la-campana-de-ivan-cepeda-estamos-uniendo-distintos-sectores-del-pais/,reacciones_politicas,no_incorporar,"La novedad sustantiva ya fue la adhesion de Murillo; esta pieza solo suma reacciones de terceros sin nuevo acuerdo programatico o hecho institucional."
