review_date,source_id,candidate_id,source_name,published_at,title,url,theme,editorial_action,reason
2026-05-12,src-20260512-paloma-medicamentos-caracol,paloma-valencia,Caracol Radio,2026-05-11,"""Haremos una compra de $3 billones en medicamentos"": Paloma Valencia sobre su propuesta en salud",https://caracol.com.co/2026/05/11/haremos-una-compra-de-3-billones-en-medicamentos-paloma-valencia-sobre-su-propuesta-en-salud/,aseguramiento_y_medicamentos,incorporar,"Entrevista reciente con mecanismo, monto, plazo y condicion de ejecucion: compra extraordinaria de medicamentos por 3 billones, pago de deudas sujeto a destrabe y continuidad de EPS."
2026-05-12,src-20260512-fajardo-plan-gobierno-elespectador,sergio-fajardo,El Espectador,2026-05-11,"Propuestas de Sergio Fajardo: este es su plan de gobierno sobre seguridad, economia, corrupcion, salud y justicia",https://www.elespectador.com/politica/elecciones-colombia-2026/propuestas-de-sergio-fajardo-este-es-su-plan-de-gobierno-sobre-seguridad-economia-corrupcion-salud-y-justicia-noticias-hoy/?outputType=amp,salud_y_fiscal,incorporar,"La pieza resume un plan reciente de 21 propuestas y permite extraer dos frentes con densidad suficiente para el monitor: estabilizacion financiera de salud con APS y un ajuste fiscal responsable para deuda y deficit."
2026-05-12,src-20260512-claudia-plan-gobierno-elespectador,claudia-lopez,El Espectador,2026-05-10,"Propuestas de Claudia Lopez: este es su plan de gobierno sobre seguridad, economia, corrupcion, salud y justicia",https://www.elespectador.com/politica/elecciones-colombia-2026/propuestas-de-claudia-lopez-este-es-su-plan-de-gobierno-sobre-seguridad-economia-corrupcion-salud-y-justicia-noticias-hoy/,seguridad_y_cuidado,incorporar,"La nota reciente, corroborada con el programa oficial ya publicado por campana, deja mecanismos identificables sobre Fiscalia Antimafia, reorganizacion judicial y Sistema Nacional de Cuidado."
2026-05-12,,ivan-cepeda,EL PAIS America Colombia,2026-05-11,"La campana de Ivan Cepeda desdena a los gurus y se refugia en los suyos",https://elpais.com/america-colombia/elecciones-presidenciales/2026-05-11/la-campana-de-ivan-cepeda-desdena-a-los-gurus-y-se-refugia-en-los-suyos.html,estilo_de_campana,no_incorporar,"Describe metodo de campana, austeridad publicitaria y centralizacion de decisiones, pero no agrega propuesta nueva, documento oficial ni instrumento programatico reciente."
2026-05-12,,abelardo-de-la-espriella,Caracol Radio,2026-05-11,"Candidato Abelardo de la Espriella hablo en Armenia de seguridad, amenazas y de la patria milagro",https://caracol.com.co/2026/05/11/candidato-abelardo-de-la-espriella-hablo-en-armenia-de-seguridad-amenazas-y-de-la-patria-milagro/,seguridad_rally,reservar,"El mitin deja senales sobre megacarceles, centros de rehabilitacion y seguridad urbana, pero falta una formulacion mas cerrada con mecanismo, costo y alcance verificable para intake formal."
