review_date,candidate_id,source_name,published_at,title,url,theme,editorial_action,reason
2026-05-24,ivan-cepeda|abelardo-de-la-espriella|paloma-valencia|sergio-fajardo|claudia-lopez|luis-gilberto-murillo,Cambio,2026-05-23 23:45:00,"La ultima encuesta antes de la primera vuelta: Cepeda y De la Espriella, cabeza a cabeza; Paloma, a veinte puntos",https://cambiocolombia.com/poder/articulo/2026/5/ultima-encuesta-antes-primera-vuelta-cepeda-espriella-cabeza-cabeza-paloma,encuestas_finales_y_veda_demoscopica,incorporar_contexto,"La pieza aporta datos metodologicos suficientes para fijar la foto final antes de la veda: 2.202 encuestas presenciales y trabajo de campo del 16 al 22 de mayo. Sirve para registrar el cierre de la pelea Cepeda-Abelardo y el rezago de Paloma, Claudia, Fajardo y Murillo, pero sigue siendo contexto multi-candidato y no intake programatico."
2026-05-24,paloma-valencia|sergio-fajardo,El Colombiano,2026-05-23 09:44:42,"Fajardo rechazo alianza con Paloma y anuncia que sigue firme en las que seran sus ultimas elecciones",https://www.elcolombiano.com/especiales/elecciones-2026/en-vivo-cafe-sergio-fajardo-y-paloma-valencia-BK36872751,alianzas_voto_util_y_centro,incorporar_contexto,"La reunion ya no es solo una invitacion tactica sino un desenlace verificable: Fajardo hace publica la conversacion, descarta una alianza con el Centro Democratico y ratifica su ruta propia a primera vuelta. Es contexto util para leer la disputa por el voto moderado, no un acuerdo programatico nuevo."
2026-05-24,ivan-cepeda,EL PAIS America Colombia,2026-05-24 04:00:00,"Ivan Cepeda se vuelca a llenar plazas publicas para buscar la Presidencia de Colombia en primera vuelta",https://elpais.com/america-colombia/elecciones-presidenciales/2026-05-24/ivan-cepeda-se-vuelca-a-llenar-plazas-publicas-para-buscar-la-presidencia-de-colombia-en-primera-vuelta.html,gobierno_itinerante_y_cierre_de_campana,reservar,"La nota atribuye a Cepeda una formulacion con potencial valor sustantivo, gobernar desde municipios rurales y ciudades en clave de gobierno itinerante. Antes de promoverla conviene contrastar la declaracion original o un documento de campana que precise alcance, mecanismo y prioridad real."
2026-05-24,paloma-valencia,El Colombiano,2026-05-23 18:07:32,"Con Uribe, Jorge Baron y criticas a Petro: asi fue el cierre de Paloma Valencia en Envigado",https://www.elcolombiano.com/especiales/elecciones-2026/con-uribe-jorge-baron-y-criticas-a-petro-asi-fue-el-cierre-de-paloma-valencia-en-envigado-GF36884534,cierre_de_campana_y_reiteracion_programatica,no_incorporar,"El evento confirma movilizacion y reitera mensajes ya conocidos sobre seguridad, salud, paz total y SOAT subsidiado, pero no agrega documento, cifra nueva verificable ni una arquitectura operativa distinta frente a lo ya capturado."
2026-05-24,abelardo-de-la-espriella,El Colombiano,2026-05-23 22:16:24,"De la Espriella cerro campana en Barranquilla ante mas de 50.000 personas y prometio hacer pagar a corruptos y criminales",https://www.elcolombiano.com/especiales/elecciones-2026/de-la-espriella-cierre-campana-barranquilla-gran-malecon-elecciones-2026-CF36888903,cierre_de_campana_y_tono_punitivo,no_incorporar,"El cierre masivo en Barranquilla y el discurso contra corruptos y criminales sirven para medir despliegue y tono, pero no suman una propuesta sectorial nueva, un mecanismo fiscal o juridico detallado, ni un hecho institucional adicional para intake."
